{
  "curves": [],
  "datasheet_identity": {
    "pages_examined": [
      "p. 1",
      "p. 2"
    ],
    "revision": "REV.08",
    "title": "FCX591"
  },
  "extraction_notes": [
    "Curve plots were examined in the supplied PDF, but no numeric curve points were retained because the plotted traces did not provide a defensible three-point digitization from the text extraction; no points were invented.",
    "Absolute ratings and electrical-characteristics values are cited only where a tabulated value was readable.",
    "Values are recorded as SI magnitudes; PNP polarity is represented by specs.polarity."
  ],
  "family": "bjt",
  "manufacturer": "Shikues",
  "mpn": "FCX591",
  "omission_reason": "No defensible numeric curve points could be extracted from the supplied PDF plots without inventing or interpolating data.",
  "schema_version": "1.0.0",
  "specs": {
    "cibo": null,
    "cobo": null,
    "ft": {
      "conditions": "V CE = -10 V,I E = -50mA, Transition frequency fT 150 MHz f=100MHz",
      "page_reference": "p. 2 electrical characteristics",
      "source_kind": "typical",
      "unit": "Hz",
      "value": 150000000.0
    },
    "gain_points": [
      {
        "collector_current": {
          "conditions": "IC = 1e-07 A, VCE = 5 V, TA = 25 degC unless otherwise noted",
          "page_reference": "p. 2 electrical characteristics",
          "source_kind": "typical",
          "unit": "A",
          "value": 1.0000000000000001e-07
        },
        "hfe": {
          "conditions": "IC = 1e-07 A, VCE = 5 V, TA = 25 degC unless otherwise noted",
          "page_reference": "p. 2 electrical characteristics",
          "source_kind": "typical",
          "unit": "1",
          "value": 300.0
        },
        "vce": {
          "conditions": "IC = 1e-07 A, VCE = 5 V, TA = 25 degC unless otherwise noted",
          "page_reference": "p. 2 electrical characteristics",
          "source_kind": "typical",
          "unit": "V",
          "value": 5.0
        }
      }
    ],
    "polarity": "pnp",
    "saturation_points": [],
    "vceo": {
      "conditions": "IC and IB conditions as stated in the cited breakdown-voltage row",
      "page_reference": "p. 2 maximum ratings/electrical characteristics",
      "source_kind": "typical",
      "unit": "V",
      "value": 80.0
    }
  },
  "usable_curves": false
}
