{
  "schema_version": "1.0.0",
  "mpn": "MJD45H11J",
  "manufacturer": "Nexperia",
  "family": "bjt",
  "datasheet_identity": {
    "title": "MJD45H11, 80 V, 8 A PNP high power bipolar transistor",
    "revision": "12 September 2019",
    "pages_examined": [
      "p. 1",
      "p. 2",
      "p. 4",
      "p. 5",
      "p. 6"
    ]
  },
  "usable_curves": true,
  "curves": [
    {
      "name": "DC current gain versus collector current at 25 degC",
      "x_axis": {
        "quantity": "collector current (PNP signed)",
        "unit": "A",
        "scale": "log"
      },
      "y_axis": {
        "quantity": "DC current gain hFE",
        "unit": "1",
        "scale": "linear"
      },
      "test_conditions": "VCE = -1 V; Tamb = 25 degC; typical curve; negative collector-current values are plotted on a logarithmic magnitude axis",
      "page_reference": "p. 4 Fig. 3, Tamb = 25 degC curve",
      "points": [
        {
          "x": -0.01,
          "y": 285.45
        },
        {
          "x": -0.1,
          "y": 279.89
        },
        {
          "x": -1.0,
          "y": 251.22
        },
        {
          "x": -2.0,
          "y": 223.65
        },
        {
          "x": -4.0,
          "y": 152.82
        },
        {
          "x": -8.0,
          "y": 56.39
        }
      ]
    },
    {
      "name": "Collector current versus collector-emitter voltage at base current -20 mA",
      "x_axis": {
        "quantity": "collector-emitter voltage (PNP signed)",
        "unit": "V",
        "scale": "linear"
      },
      "y_axis": {
        "quantity": "collector current (PNP signed)",
        "unit": "A",
        "scale": "linear"
      },
      "test_conditions": "IB = -20 mA; Tamb = 25 degC; typical curve",
      "page_reference": "p. 4 Fig. 4, IB = -20 mA curve",
      "points": [
        {
          "x": -0.5,
          "y": -2.6111
        },
        {
          "x": -1.0,
          "y": -3.1513
        },
        {
          "x": -2.0,
          "y": -3.5189
        },
        {
          "x": -3.0,
          "y": -3.6584
        },
        {
          "x": -4.0,
          "y": -3.7595
        }
      ]
    },
    {
      "name": "Collector current versus collector-emitter voltage at base current -80 mA",
      "x_axis": {
        "quantity": "collector-emitter voltage (PNP signed)",
        "unit": "V",
        "scale": "linear"
      },
      "y_axis": {
        "quantity": "collector current (PNP signed)",
        "unit": "A",
        "scale": "linear"
      },
      "test_conditions": "IB = -80 mA; Tamb = 25 degC; typical curve",
      "page_reference": "p. 4 Fig. 4, IB = -80 mA curve",
      "points": [
        {
          "x": -0.5,
          "y": -4.7575
        },
        {
          "x": -1.0,
          "y": -5.6162
        },
        {
          "x": -2.0,
          "y": -6.7581
        },
        {
          "x": -3.0,
          "y": -7.4500
        },
        {
          "x": -4.0,
          "y": -7.8984
        }
      ]
    }
  ],
  "specs": {
    "polarity": "pnp",
    "gain_points": [
      {
        "collector_current": {
          "value": -2.0,
          "unit": "A",
          "conditions": "VCE = -1 V, Tamb = 25 degC",
          "page_reference": "p. 4 Table 7, DC current gain",
          "source_kind": "typical"
        },
        "vce": {
          "value": -1.0,
          "unit": "V",
          "conditions": "IC = -2 A, Tamb = 25 degC",
          "page_reference": "p. 4 Table 7, DC current gain",
          "source_kind": "typical"
        },
        "hfe": {
          "value": 60,
          "unit": "1",
          "conditions": "IC = -2 A, VCE = -1 V, Tamb = 25 degC",
          "page_reference": "p. 4 Table 7, DC current gain",
          "source_kind": "minimum"
        }
      },
      {
        "collector_current": {
          "value": -4.0,
          "unit": "A",
          "conditions": "VCE = -1 V, Tamb = 25 degC",
          "page_reference": "p. 4 Table 7, DC current gain",
          "source_kind": "typical"
        },
        "vce": {
          "value": -1.0,
          "unit": "V",
          "conditions": "IC = -4 A, Tamb = 25 degC",
          "page_reference": "p. 4 Table 7, DC current gain",
          "source_kind": "typical"
        },
        "hfe": {
          "value": 40,
          "unit": "1",
          "conditions": "IC = -4 A, VCE = -1 V, Tamb = 25 degC",
          "page_reference": "p. 4 Table 7, DC current gain",
          "source_kind": "minimum"
        }
      }
    ],
    "saturation_points": [
      {
        "collector_current": {
          "value": -8.0,
          "unit": "A",
          "conditions": "IB = -400 mA, Tamb = 25 degC",
          "page_reference": "p. 4 Table 7, collector-emitter saturation voltage",
          "source_kind": "typical"
        },
        "base_current": {
          "value": -0.4,
          "unit": "A",
          "conditions": "IC = -8 A, Tamb = 25 degC",
          "page_reference": "p. 4 Table 7, collector-emitter saturation voltage",
          "source_kind": "typical"
        },
        "vce_sat": {
          "value": -1.0,
          "unit": "V",
          "conditions": "IC = -8 A, IB = -400 mA, Tamb = 25 degC",
          "page_reference": "p. 4 Table 7, collector-emitter saturation voltage",
          "source_kind": "maximum"
        },
        "vbe_sat": {
          "value": -1.5,
          "unit": "V",
          "conditions": "IC = -8 A, IB = -800 mA, Tamb = 25 degC",
          "page_reference": "p. 4 Table 7, base-emitter saturation voltage",
          "source_kind": "maximum"
        }
      }
    ],
    "ft": {
      "value": 80000000,
      "unit": "Hz",
      "conditions": "VCE = -10 V, IC = -500 mA, f = 100 MHz, Tamb = 25 degC",
      "page_reference": "p. 4 Table 7, transition frequency",
      "source_kind": "typical"
    },
    "cobo": {
      "value": 8e-11,
      "unit": "F",
      "conditions": "VCB = -10 V, IE = 0 A, ie = 0 A, f = 1 MHz, Tamb = 25 degC",
      "page_reference": "p. 4 Table 7, collector capacitance Cc",
      "source_kind": "typical"
    },
    "cibo": null,
    "vceo": {
      "value": -80.0,
      "unit": "V",
      "conditions": "open base",
      "page_reference": "p. 2 Table 5, limiting values",
      "source_kind": "maximum"
    }
  },
  "extraction_notes": [
    "PDF SHA-256 verified as 1ade9d5c4d6eae7d355d048e7edb88e1ea276d42795c360e1acdf467a9d83cd1.",
    "The supplied MPN is MJD45H11J; the public datasheet title and type number are MJD45H11. The supplied MPN is retained exactly and no separate suffix-J electrical variant was inferred.",
    "PNP polarity is preserved with negative collector current, base current, collector-emitter voltage, base-emitter saturation voltage, and collector-emitter saturation voltage values.",
    "Curve points were digitized from the native vector curves in Fig. 3 and Fig. 4 at explicitly selected axis positions; no interpolated points were added.",
    "The datasheet provides one VCEsat/VBEsat table row only. The saturation_points array therefore contains the single permitted table pair rather than inventing a second operating point.",
    "The datasheet provides collector capacitance Cc, mapped to cobo. No tabulated input capacitance Cibo value is provided; Fig. 9 shows Ce graphically, so cibo is null rather than inferred.",
    "Only 25 degC electrical data was transcribed; temperature-dependent curves and thermal ratings are not represented by this schema."
  ],
  "omission_reason": null
}
