{
  "schema_version": "1.0.0",
  "mpn": "MMBT9014C",
  "manufacturer": "ST Semtech",
  "family": "bjt",
  "datasheet_identity": {
    "title": "MMBT9014 NPN Silicon Epitaxial Planar Transistor for switching and AF amplifier applications",
    "revision": "02",
    "pages_examined": [
      "1",
      "2"
    ]
  },
  "usable_curves": true,
  "curves": [
    {
      "name": "DC Current Gain vs Collector Current",
      "x_axis": {
        "quantity": "Collector Current",
        "unit": "mA",
        "scale": "log"
      },
      "y_axis": {
        "quantity": "DC Current Gain",
        "unit": "dimensionless",
        "scale": "log"
      },
      "test_conditions": "VCE = 5 V, Ta = 25°C",
      "page_reference": "2",
      "points": [
        {
          "x": 0.5,
          "y": 150
        },
        {
          "x": 1,
          "y": 200
        },
        {
          "x": 5,
          "y": 250
        },
        {
          "x": 10,
          "y": 270
        },
        {
          "x": 50,
          "y": 280
        },
        {
          "x": 100,
          "y": 270
        },
        {
          "x": 500,
          "y": 150
        },
        {
          "x": 1000,
          "y": 100
        }
      ]
    },
    {
      "name": "Base-Emitter Saturation Voltage vs Collector Current",
      "x_axis": {
        "quantity": "Collector Current",
        "unit": "mA",
        "scale": "log"
      },
      "y_axis": {
        "quantity": "Base-Emitter Saturation Voltage",
        "unit": "V",
        "scale": "log"
      },
      "test_conditions": "IB = 20 µA, Ta = 25°C",
      "page_reference": "2",
      "points": [
        {
          "x": 10,
          "y": 0.65
        },
        {
          "x": 20,
          "y": 0.70
        },
        {
          "x": 50,
          "y": 0.75
        },
        {
          "x": 100,
          "y": 0.80
        },
        {
          "x": 500,
          "y": 0.90
        },
        {
          "x": 1000,
          "y": 1.00
        }
      ]
    },
    {
      "name": "Collector-Emitter Saturation Voltage vs Collector Current",
      "x_axis": {
        "quantity": "Collector Current",
        "unit": "mA",
        "scale": "log"
      },
      "y_axis": {
        "quantity": "Collector-Emitter Saturation Voltage",
        "unit": "V",
        "scale": "log"
      },
      "test_conditions": "IB = 20 µA, Ta = 25°C",
      "page_reference": "2",
      "points": [
        {
          "x": 10,
          "y": 0.050
        },
        {
          "x": 20,
          "y": 0.060
        },
        {
          "x": 50,
          "y": 0.10
        },
        {
          "x": 100,
          "y": 0.15
        },
        {
          "x": 500,
          "y": 0.22
        },
        {
          "x": 1000,
          "y": 0.28
        }
      ]
    },
    {
      "name": "Gain Bandwidth Product vs Collector Current",
      "x_axis": {
        "quantity": "Collector Current",
        "unit": "mA",
        "scale": "log"
      },
      "y_axis": {
        "quantity": "Gain Bandwidth Product",
        "unit": "MHz",
        "scale": "linear"
      },
      "test_conditions": "VCE = 5 V, Ta = 25°C",
      "page_reference": "2",
      "points": [
        {
          "x": 1,
          "y": 100
        },
        {
          "x": 5,
          "y": 180
        },
        {
          "x": 10,
          "y": 250
        },
        {
          "x": 50,
          "y": 300
        },
        {
          "x": 100,
          "y": 320
        },
        {
          "x": 500,
          "y": 280
        },
        {
          "x": 1000,
          "y": 200
        }
      ]
    }
  ],
  "specs": {
    "polarity": "npn",
    "gain_points": [
      {
        "collector_current": {
          "value": 1,
          "unit": "mA",
          "conditions": "VCE = 5 V, Ta = 25°C",
          "page_reference": "1",
          "source_kind": "minimum"
        },
        "vce": {
          "value": 5,
          "unit": "V",
          "conditions": "Test condition voltage",
          "page_reference": "1",
          "source_kind": "typical"
        },
        "hfe": {
          "value": 200,
          "unit": "dimensionless",
          "conditions": "MMBT9014C variant minimum",
          "page_reference": "1",
          "source_kind": "minimum"
        }
      },
      {
        "collector_current": {
          "value": 1,
          "unit": "mA",
          "conditions": "VCE = 5 V, Ta = 25°C",
          "page_reference": "1",
          "source_kind": "maximum"
        },
        "vce": {
          "value": 5,
          "unit": "V",
          "conditions": "Test condition voltage",
          "page_reference": "1",
          "source_kind": "typical"
        },
        "hfe": {
          "value": 450,
          "unit": "dimensionless",
          "conditions": "MMBT9014C variant maximum",
          "page_reference": "1",
          "source_kind": "maximum"
        }
      },
      {
        "collector_current": {
          "value": 10,
          "unit": "mA",
          "conditions": "VCE = 5 V, Ta = 25°C",
          "page_reference": "2",
          "source_kind": "digitized_typical_curve"
        },
        "vce": {
          "value": 5,
          "unit": "V",
          "conditions": "Test condition voltage",
          "page_reference": "2",
          "source_kind": "typical"
        },
        "hfe": {
          "value": 270,
          "unit": "dimensionless",
          "conditions": "Digitized from Figure 2",
          "page_reference": "2",
          "source_kind": "digitized_typical_curve"
        }
      }
    ],
    "saturation_points": [
      {
        "collector_current": {
          "value": 100,
          "unit": "mA",
          "conditions": "At saturation, IB = 10 mA",
          "page_reference": "1",
          "source_kind": "maximum"
        },
        "base_current": {
          "value": 10,
          "unit": "mA",
          "conditions": "Saturation base current",
          "page_reference": "1",
          "source_kind": "typical"
        },
        "vce_sat": {
          "value": 0.25,
          "unit": "V",
          "conditions": "IC = 100 mA, IB = 10 mA",
          "page_reference": "1",
          "source_kind": "maximum"
        },
        "vbe_sat": {
          "value": 1.0,
          "unit": "V",
          "conditions": "IC = 100 mA, IB = 5 mA",
          "page_reference": "1",
          "source_kind": "maximum"
        }
      },
      {
        "collector_current": {
          "value": 20,
          "unit": "mA",
          "conditions": "At saturation, IB = 20 µA",
          "page_reference": "2",
          "source_kind": "digitized_typical_curve"
        },
        "base_current": {
          "value": 0.020,
          "unit": "mA",
          "conditions": "Digitized from Figure 3",
          "page_reference": "2",
          "source_kind": "digitized_typical_curve"
        },
        "vce_sat": {
          "value": 0.060,
          "unit": "V",
          "conditions": "Digitized from Figure 3",
          "page_reference": "2",
          "source_kind": "digitized_typical_curve"
        },
        "vbe_sat": {
          "value": 0.70,
          "unit": "V",
          "conditions": "Digitized from Figure 3",
          "page_reference": "2",
          "source_kind": "digitized_typical_curve"
        }
      }
    ],
    "ft": {
      "value": 100,
      "unit": "MHz",
      "conditions": "VCE = 5 V, IC = 10 mA",
      "page_reference": "1",
      "source_kind": "minimum"
    },
    "cobo": {
      "value": 6,
      "unit": "pF",
      "conditions": "VCB = 10 V, f = 1 MHz",
      "page_reference": "1",
      "source_kind": "maximum"
    },
    "cibo": null,
    "vceo": {
      "value": 45,
      "unit": "V",
      "conditions": "Collector-Emitter breakdown voltage at IC = 1 mA",
      "page_reference": "1",
      "source_kind": "minimum"
    }
  },
  "extraction_notes": [
    "MMBT9014C variant extracted from public ST Semtech datasheet dated 16/03/2015 Rev 02",
    "Polarity: NPN silicon epitaxial planar transistor",
    "Four readable curves digitized from page 2: DC current gain (Figure 2), base-emitter saturation (Figure 3), collector-emitter saturation (Figure 3), and gain-bandwidth product (Figure 4)",
    "All curves use logarithmic collector current scale; gain and saturation voltages extracted with high confidence",
    "DC gain table values (hFE 200-450 at VCE=5V, IC=1mA) match curve shape and are baseline specs for variant C",
    "Saturation voltages consistent across table (max 0.25V VCE, max 1V VBE at 100mA) and curve digitization",
    "Gain-bandwidth product minimum of 100 MHz at 10mA operating point matches specified minimum on page 1",
    "Output capacitance Cob maximum 6 pF at 10V, 1 MHz from table",
    "VCEO rated minimum 45V (collector-emitter breakdown voltage) from absolute maximum ratings"
  ],
  "omission_reason": null
}
