{
  "curves": [],
  "datasheet_identity": {
    "pages_examined": [
      "p. 1",
      "p. 2",
      "p. 3",
      "p. 4",
      "p. 5",
      "p. 6"
    ],
    "revision": "Rev.F Apr.-2017",
    "title": "9014M"
  },
  "extraction_notes": [
    "Curve plots were examined in the supplied PDF, but no numeric curve points were retained because the plotted traces did not provide a defensible three-point digitization from the text extraction; no points were invented.",
    "Absolute ratings and electrical-characteristics values are cited only where a tabulated value was readable.",
    "Values are recorded as SI magnitudes; PNP polarity is represented by specs.polarity.",
    "Bounded retry note: bjt.dc_current_gain: catalog '200' disagrees with extracted [1000.0]; closest ratio 5x"
  ],
  "family": "bjt",
  "manufacturer": "Foshan Blue Rocket Elec",
  "mpn": "9014M-C HJ6C",
  "omission_reason": "No defensible numeric curve points could be extracted from the supplied PDF plots without inventing or interpolating data.",
  "schema_version": "1.0.0",
  "specs": {
    "cibo": null,
    "cobo": {
      "conditions": "VCB test bias; IE = 0; f = 1 MHz",
      "page_reference": "p. 2 electrical characteristics",
      "source_kind": "typical",
      "unit": "F",
      "value": 3.5e-12
    },
    "ft": {
      "conditions": "Base-Emitter Voltage VBE VCE=5.0V IC=2.0mA 0.63 0.7 V Transition Frequency fT VCE=5.0V IC=10mA 150 270 MHz VCB=10V IE=0 Collector Output Capacitance Cob 2.2 3.5 pF f=1.0MHz VCE=5.0V IC=0.2mA",
      "page_reference": "p. 2 electrical characteristics",
      "source_kind": "typical",
      "unit": "Hz",
      "value": 270000000.0
    },
    "gain_points": [
      {
        "collector_current": {
          "conditions": "IC = 5e-08 A, VCE = 5 V, TA = 25 degC unless otherwise noted",
          "page_reference": "p. 2 electrical characteristics",
          "source_kind": "typical",
          "unit": "A",
          "value": 5e-08
        },
        "hfe": {
          "conditions": "IC = 5e-08 A, VCE = 5 V, TA = 25 degC unless otherwise noted",
          "page_reference": "p. 2 electrical characteristics",
          "source_kind": "typical",
          "unit": "1",
          "value": 1000.0
        },
        "vce": {
          "conditions": "IC = 5e-08 A, VCE = 5 V, TA = 25 degC unless otherwise noted",
          "page_reference": "p. 2 electrical characteristics",
          "source_kind": "typical",
          "unit": "V",
          "value": 5.0
        }
      }
    ],
    "polarity": "npn",
    "saturation_points": [],
    "vceo": {
      "conditions": "IC and IB conditions as stated in the cited breakdown-voltage row",
      "page_reference": "p. 2 maximum ratings/electrical characteristics",
      "source_kind": "typical",
      "unit": "V",
      "value": 50.0
    }
  },
  "usable_curves": false
}
