{
  "curves": [],
  "datasheet_identity": {
    "pages_examined": [
      "p. 1",
      "p. 2",
      "p. 3",
      "p. 4",
      "p. 5",
      "p. 6"
    ],
    "revision": "Rev. 12, October 2016",
    "title": "MMBT5550L, MMBT5551L, high voltage transistors"
  },
  "extraction_notes": [
    "Curve plots were examined in the supplied PDF, but no numeric curve points were retained because the plotted traces did not provide a defensible three-point digitization from the text extraction; no points were invented.",
    "Absolute ratings and electrical-characteristics values are cited only where a tabulated value was readable.",
    "Values are recorded as SI magnitudes; PNP polarity is represented by specs.polarity."
  ],
  "family": "bjt",
  "manufacturer": "onsemi",
  "mpn": "SMMBT5551LT1G",
  "omission_reason": "Characteristic plots are present, but the supplied rendering does not expose three or more exact numeric coordinates; emitting digitized points would require interpolation.",
  "schema_version": "1.0.0",
  "specs": {
    "cibo": null,
    "cobo": null,
    "ft": null,
    "gain_points": [
      {
        "collector_current": {
          "conditions": "IC = 0.001 A, VCE = 5 V, TA = 25 degC",
          "page_reference": "p. 2",
          "source_kind": "minimum",
          "unit": "A",
          "value": 0.001
        },
        "hfe": {
          "conditions": "IC = 0.001 A, VCE = 5 V, TA = 25 degC",
          "page_reference": "p. 2",
          "source_kind": "minimum",
          "unit": "1",
          "value": 80
        },
        "vce": {
          "conditions": "IC = 0.001 A, VCE = 5 V, TA = 25 degC",
          "page_reference": "p. 2",
          "source_kind": "minimum",
          "unit": "V",
          "value": 5.0
        }
      },
      {
        "collector_current": {
          "conditions": "IC = 0.01 A, VCE = 5 V, TA = 25 degC",
          "page_reference": "p. 2",
          "source_kind": "minimum",
          "unit": "A",
          "value": 0.01
        },
        "hfe": {
          "conditions": "IC = 0.01 A, VCE = 5 V, TA = 25 degC",
          "page_reference": "p. 2",
          "source_kind": "minimum",
          "unit": "1",
          "value": 80
        },
        "vce": {
          "conditions": "IC = 0.01 A, VCE = 5 V, TA = 25 degC",
          "page_reference": "p. 2",
          "source_kind": "minimum",
          "unit": "V",
          "value": 5.0
        }
      },
      {
        "collector_current": {
          "conditions": "IC = 0.01 A, VCE = 5 V, TA = 25 degC",
          "page_reference": "p. 2",
          "source_kind": "maximum",
          "unit": "A",
          "value": 0.01
        },
        "hfe": {
          "conditions": "IC = 0.01 A, VCE = 5 V, TA = 25 degC",
          "page_reference": "p. 2",
          "source_kind": "maximum",
          "unit": "1",
          "value": 250
        },
        "vce": {
          "conditions": "IC = 0.01 A, VCE = 5 V, TA = 25 degC",
          "page_reference": "p. 2",
          "source_kind": "maximum",
          "unit": "V",
          "value": 5.0
        }
      },
      {
        "collector_current": {
          "conditions": "IC = 0.05 A, VCE = 5 V, TA = 25 degC",
          "page_reference": "p. 2",
          "source_kind": "minimum",
          "unit": "A",
          "value": 0.05
        },
        "hfe": {
          "conditions": "IC = 0.05 A, VCE = 5 V, TA = 25 degC",
          "page_reference": "p. 2",
          "source_kind": "minimum",
          "unit": "1",
          "value": 30
        },
        "vce": {
          "conditions": "IC = 0.05 A, VCE = 5 V, TA = 25 degC",
          "page_reference": "p. 2",
          "source_kind": "minimum",
          "unit": "V",
          "value": 5.0
        }
      }
    ],
    "polarity": "npn",
    "saturation_points": [
      {
        "base_current": {
          "conditions": "IC = 0.01 A, IB = 0.001 A, TA = 25 degC; pulse width = 300 us, duty cycle = 2.0%",
          "page_reference": "p. 2",
          "source_kind": "maximum",
          "unit": "A",
          "value": 0.001
        },
        "collector_current": {
          "conditions": "IC = 0.01 A, IB = 0.001 A, TA = 25 degC; pulse width = 300 us, duty cycle = 2.0%",
          "page_reference": "p. 2",
          "source_kind": "maximum",
          "unit": "A",
          "value": 0.01
        },
        "vbe_sat": {
          "conditions": "IC = 0.01 A, IB = 0.001 A, TA = 25 degC; pulse width = 300 us, duty cycle = 2.0%",
          "page_reference": "p. 2",
          "source_kind": "maximum",
          "unit": "V",
          "value": 1.0
        },
        "vce_sat": {
          "conditions": "IC = 0.01 A, IB = 0.001 A, TA = 25 degC; pulse width = 300 us, duty cycle = 2.0%",
          "page_reference": "p. 2",
          "source_kind": "maximum",
          "unit": "V",
          "value": 0.15
        }
      },
      {
        "base_current": {
          "conditions": "IC = 0.05 A, IB = 0.005 A, TA = 25 degC; pulse width = 300 us, duty cycle = 2.0%",
          "page_reference": "p. 2",
          "source_kind": "maximum",
          "unit": "A",
          "value": 0.005
        },
        "collector_current": {
          "conditions": "IC = 0.05 A, IB = 0.005 A, TA = 25 degC; pulse width = 300 us, duty cycle = 2.0%",
          "page_reference": "p. 2",
          "source_kind": "maximum",
          "unit": "A",
          "value": 0.05
        },
        "vbe_sat": {
          "conditions": "IC = 0.05 A, IB = 0.005 A, TA = 25 degC; pulse width = 300 us, duty cycle = 2.0%",
          "page_reference": "p. 2",
          "source_kind": "maximum",
          "unit": "V",
          "value": 1.0
        },
        "vce_sat": {
          "conditions": "IC = 0.05 A, IB = 0.005 A, TA = 25 degC; pulse width = 300 us, duty cycle = 2.0%",
          "page_reference": "p. 2",
          "source_kind": "maximum",
          "unit": "V",
          "value": 0.2
        }
      }
    ],
    "vceo": {
      "conditions": "IC = 1.0 mA, IB = 0, MMBT5551 type, TA = 25 degC",
      "page_reference": "p. 2",
      "source_kind": "minimum",
      "unit": "V",
      "value": 160.0
    }
  },
  "usable_curves": false
}
