{
  "curves": [],
  "datasheet_identity": {
    "pages_examined": [
      "p. 1",
      "p. 2",
      "p. 3"
    ],
    "revision": "Revision not stated in supplied PDF",
    "title": "BCX54, BCX55, BCX56 NPN Plastic-Encapsulate Transistors"
  },
  "extraction_notes": [
    "The datasheet identifies BCX56 as part of an NPN transistor family on p. 1; the catalog discrepancy was resolved from the datasheet polarity.",
    "The table publishes VBE at IC = 0.5 A and VCE = 2 V, not VBE(sat), so vbe_sat is null for the saturation point.",
    "Capacitance plots are present but no tabulated Cobo or Cibo values were emitted."
  ],
  "family": "bjt",
  "manufacturer": "HXY MOSFET",
  "mpn": "BCX56",
  "omission_reason": "The supplied datasheet contains characteristic plots, but the plotted traces do not expose at least three exact numeric coordinates without interpolation; no curve points were emitted.",
  "schema_version": "1.0.0",
  "specs": {
    "cibo": null,
    "cobo": null,
    "ft": {
      "conditions": "VCE = 5 V, IC = 10 mA, f = 100 MHz, TA = 25 degC",
      "page_reference": "p. 2 electrical characteristics",
      "source_kind": "typical",
      "unit": "Hz",
      "value": 130000000.0
    },
    "gain_points": [
      {
        "collector_current": {
          "conditions": "VCE = 2 V, IC = 0.005 A",
          "page_reference": "p. 2 electrical characteristics",
          "source_kind": "minimum",
          "unit": "A",
          "value": 0.005
        },
        "hfe": {
          "conditions": "IC = 0.005 A, VCE = 2 V",
          "page_reference": "p. 2 electrical characteristics",
          "source_kind": "minimum",
          "unit": "1",
          "value": 40
        },
        "vce": {
          "conditions": "IC = 0.005 A",
          "page_reference": "p. 2 electrical characteristics",
          "source_kind": "minimum",
          "unit": "V",
          "value": 2.0
        }
      },
      {
        "collector_current": {
          "conditions": "VCE = 2 V, IC = 0.15 A",
          "page_reference": "p. 2 electrical characteristics",
          "source_kind": "minimum",
          "unit": "A",
          "value": 0.15
        },
        "hfe": {
          "conditions": "IC = 0.15 A, VCE = 2 V",
          "page_reference": "p. 2 electrical characteristics",
          "source_kind": "minimum",
          "unit": "1",
          "value": 63
        },
        "vce": {
          "conditions": "IC = 0.15 A",
          "page_reference": "p. 2 electrical characteristics",
          "source_kind": "minimum",
          "unit": "V",
          "value": 2.0
        }
      },
      {
        "collector_current": {
          "conditions": "VCE = 2 V, IC = 0.15 A",
          "page_reference": "p. 2 electrical characteristics",
          "source_kind": "maximum",
          "unit": "A",
          "value": 0.15
        },
        "hfe": {
          "conditions": "IC = 0.15 A, VCE = 2 V",
          "page_reference": "p. 2 electrical characteristics",
          "source_kind": "maximum",
          "unit": "1",
          "value": 250
        },
        "vce": {
          "conditions": "IC = 0.15 A",
          "page_reference": "p. 2 electrical characteristics",
          "source_kind": "maximum",
          "unit": "V",
          "value": 2.0
        }
      },
      {
        "collector_current": {
          "conditions": "VCE = 2 V, IC = 0.5 A",
          "page_reference": "p. 2 electrical characteristics",
          "source_kind": "minimum",
          "unit": "A",
          "value": 0.5
        },
        "hfe": {
          "conditions": "IC = 0.5 A, VCE = 2 V",
          "page_reference": "p. 2 electrical characteristics",
          "source_kind": "minimum",
          "unit": "1",
          "value": 25
        },
        "vce": {
          "conditions": "IC = 0.5 A",
          "page_reference": "p. 2 electrical characteristics",
          "source_kind": "minimum",
          "unit": "V",
          "value": 2.0
        }
      }
    ],
    "polarity": "npn",
    "saturation_points": [
      {
        "base_current": {
          "conditions": "IC = 0.5 A",
          "page_reference": "p. 2 electrical characteristics",
          "source_kind": "typical",
          "unit": "A",
          "value": 0.05
        },
        "collector_current": {
          "conditions": "IB = 0.05 A",
          "page_reference": "p. 2 electrical characteristics",
          "source_kind": "typical",
          "unit": "A",
          "value": 0.5
        },
        "vbe_sat": null,
        "vce_sat": {
          "conditions": "IC = 0.5 A, IB = 0.05 A",
          "page_reference": "p. 2 electrical characteristics",
          "source_kind": "typical",
          "unit": "V",
          "value": 0.5
        }
      }
    ],
    "vceo": {
      "conditions": "Collector-emitter breakdown voltage, IC = 10 mA, IB = 0, BCX56",
      "page_reference": "p. 2 electrical characteristics",
      "source_kind": "minimum",
      "unit": "V",
      "value": 80.0
    }
  },
  "usable_curves": false
}
